{"schema":"harness.knowledge-item.v1","knowledge_id":"lesson-1","kind":"procedure","statement":"Reviewed display-only lesson.","scope":{"repository_id":"repo","task_family":"context","model_family":null,"runtime_class":null},"evidence":[{"kind":"trace","revision_id":"trace-1","digest":"aaaaaaaaaaaaaaaaaaaaaaaaaaaaaaaaaaaaaaaaaaaaaaaaaaaaaaaaaaaaaaaa","split":null,"custody":null}],"confidence_milli":900,"review":{"state":"accepted","reviewer_id":"operator-1","reviewed_at":1,"receipt":{"kind":"human_review","revision_id":"review-1","digest":"aaaaaaaaaaaaaaaaaaaaaaaaaaaaaaaaaaaaaaaaaaaaaaaaaaaaaaaaaaaaaaaa","split":null,"custody":null}},"freshness":{"created_at":1,"revalidate_after":2,"expires_at":3},"contradicts":[],"supersedes":[],"state":"active","sha256":"8f7d8392d9db07df7e1a3c01c08633ed494a267b45c77044450d8b92c41c9927"}
